Supplier,
ABBAS GLASS INDUSTRY LLC,
ABHA Garage,
Aboras Group,
AD Aiprort,
Adel Almulla Car Accessories,
ADHWA,
Adhwa Al Mdinah Documents Typing & Copyings,
Admiral Tech Hardware Trading,
ADNOC,
Advance General Trading Co.LLC,
Ahmed Mohd.Ghanim Building Materials LLC,
Ahmed Sultana Trucks Reparing,
Aikah For General Trading LLC,
Air Master Equipments Emirates LLC,
Akkad Pest Control Services,
Al Azeemah Trading LLC,
Al Azhar Paints Trading LLC,
AL Azrar Building Materials Trading LLC,
Al Bahar Carpets And Curtains TR,
Al Balagh Parking,
Al Baraha Furniture Co LLC,
Al Barakah Auto Spare Parts Trading LLC,
Al Barakah Carwash,
Al Baz Refrigeration Spare Parts Est.,
Al Danube Building Materials Trading Co LLC,
Al Dereya Scaffolding Trading LLC,
Al Diyafa A/C Repairing,
Al Ertqaa Car Park Rental,
Al Furjan Star Building & Construction Materials,
Al Futtaim Motors,
Al Futtaim Trading Co LLC,
Al Ishraq Turning Workshop,
Al Jafliyah Gas Distribution LLC,
Al Jawdah Environmental Services LLC,
Al Jessour Building Material Trading LLC,
Al Kassar Trading Co LLC,
Al Khazana Car Park Rental LLC,
Al Khyar Al Afdal Supermarket & Mill,
Al Madina Hyper Studio,
Al Madwi,
Al Mamun Metalic Coating Steel FAbrication LLC,
Al Manara Star Grocery,
Al Mas,
Al Meena Water Pumps Rep & Fix/W/Shop,
Al Milad Building Materialing Trading LLC,
Al Muheet Al Thahabi Car Services,
Al Mutakamela Vechicles Testings and Registration L,
Al Mutaqdm Parking Car Washing,
Al Mutatawer Auto Spare Parts,
Al Naeem Auto Spare Parts Trading LLC,
Al Najah Grocery Co.,
AL Najma Al Fedhi  Locks & Watches Repairing,
Al Namariq Building Material Trading Company Limite,
Al Namariq Building Material Trading Company LLC,
Al Naseer Valley,
Al Nibras Al Abyadh Bldg. Mat. Tr. LLC,
Al Obaid Salmeen Watches & Shoe Reparing,
Al Qarqa Elect & Motor Turning,
Al Quoz Building Material Trading LLC,
Al Quoz Dhahabi Car Accessories Tyres Trading,
Al Quoz View Restaurant & Cafeteria,
Al Rahma and Tines Group FZCO,
Al Revera Auto Rep. Work Shop,
Al Sad Al Jadid Building Mat. LLC,
Al Sad Building Mat. LLC,
Al Sahab Building Mat.Tr.,
Al Sanam Bakery,
Al Shabib Trading LLC,
Al Shahouf Auto Rep W.Shop,
AL Shamsi MEP,
Al Shuaa Hydralic Pipes Tr. LLC,
Al Sousi Trading Co LLC,
Al Tanoof Electricals LLC,
AL Taqwa Ware Tr. LLC,
Al Tower Used Furniture Trading,
Al Waha Hygiene,
Al Wasel Fire Fighting LLC,
Al Wifaq General Trading LLC,
Alasayel Traditional Kitchen & Restaurant LLC,
Ali Baba Grage,
Ali Mohammed Hashem Grocery,
Ali Obaid Salmeen Watches & Shoe Reparings,
Alif Albalagh Cleaning & Polishing Cars LLC,
Alif Tools & Hardware Trading,
All Day Retall,
Altamiz Waste Collecton & Transportation Services L,
Alzan Building Materials Trading LLC,
Amazon Car Park Rental,
AMMA'S RESTURANT LLC,
ANBI Air Condition Trading LLC,
Anchor Allied Factory LLC,
Aqua Zone LLC,
Arabian Sand Washing LLC,
ARJ Auto Lube Center,
Arus Al Madina Restaurant,
Astral Technical Services LLC,
Astralux Pools LLC,
ATE International Building Materials LLC,
Athmer Middle East BMT LLC,
Auto Lighting Trdg LLC,
Auto Pro,
Auto Pro Car Care Professionals,
Automo Choice of Quality,
Ayhaco Group,
Azam DArbar Cafeterar,
Azhar Boom Boom,
Bab Al Khail Tyre Fitting & Repairing,
Bab Al Safa Accessories And Upholistery Co.LLC,
Bab Khaiber Auto Spare Parts TR LLC,
Bahwalpur Water Transport LLC,
Bakht Pur Used Auto Spares Parts TR,
Baniyas Building Materials Co LLC,
Bashaire Restaurant,
Batteryman Mobile Auto Repair Services LLC,
Beta Industrail LLC,
Betalink Instrument & Calib. Serv. LLC,
Better Life,
Bianca & Bianco Building Materials Trading LLC,
Bid City Auto Services CO LLC,
Biknervala Restaurant Branch,
Bilawal Baloch EQip Rental LLC,
Bin Abid restaurant,
Bin Jameel Building & Construction Material Trading,
Blu Intelligent Soloution General Trading LLC,
BMC Service Center,
BNT Air Conditioning Systems LLC,
Build Zone Building Materials,
Builtech Trading LLC,
Burj Steel Works LLC,
BURKAN BUILDING MATERIALS TRDG.LLC,
Bustan Al Arab Metal Works,
CAfu Petroleum Transport LLC,
Cannelle Trading LLC,
Canvas General Trading LLC,
Car Park Rental LLC,
Century Mechanical System Factory LLC,
Chabros Timber Trding LLC,
Citi Plus General Trading LLC,
City Land Transport,
City Point Gen. Trading LLC,
Clean Car,
Cleanline,
Conmix Ltd,
Consort Middle East LLC,
Crown Pump Industry LLC,
Culligan International Emirates LLC,
Danube Homes,
Dar Al Almas W.Shops Tools Maint,
Dar Al Khair Kitchen,
Dar Al Khaleej Auto Services,
Dar Al Wafa Building Materials LLC,
Dar Darbar Restaurant,
Day to Day,
Deans Life Pharmacy L.L.C,
DEWA Payable,
Dinesh Aidasani General Trading LLC,
Dr. Sanjay Medical Center,
Dream Planet Trading LLC,
Dream Wood Laminates Building Materials TR LLC,
Dubai Adhesive Material Factory LLC,
Dubai Retail Asset LLC,
DUCTFAB LLC,
DXB Solutions LLC,
Ebara Pumps Middle East FZE,
Eclipse Electricals LLC,
Ectratech Trading LLC,
Elegant Trading LLC,
Emaar Business Park,
Emarat,
Emaratech,
Emirates International Equipments Machinery LLC,
Empire Height,
ENOC,
Excel Middle East LLC,
Expert Pharmacy,
Faaz,
Faisal Umer Transport By Heavy and Licght Truck LLC,
Faiz Khair Transport by Heavy and Light Trucks LLC,
Faraidooni LLC,
Farrakh Shahzad Cargo Transport By Heavy Truck LLC,
Fast Removal Transport LLC,
FAZA  Building Materials Trading LLC,
FEDEX Express,
Fikree Pipe LLC,
Filipino Garage,
Fine Tech Glass & Metal Co. LLC,
Fine Tools Equipment Reparing LLC,
Finetools Trading LLC,
Fineway Garage,
Future Link LLC,
Garden VAlley Building Materials Trading LLC,
Garden Vally  Restaurant,
Gate Most Item 1 to 10 Aed,
Gate Way Moving Doors,
Gemini Building Materials LLC,
Ghulam Shabbir Taxi Pickup Services,
Gift City,
Global Fiber Glass FZC,
Golden Dreams,
Goldenway Elect.Ware Tr.LLC,
Good Hand Stones and Concrere Flooring LLC,
Grand Hyper,
Graniti Building Materials LLC,
Green Gift,
Guangzhou ZHendong Arts & Crafts FZCO,
Gujrat Traders,
Gulf Leisure BBQ General Trading LLC,
Hafele Middle East Trading LLC,
Haji Abdul Rahim Trading LLC,
Hamad Rahma A.Alshasi General Trading,
Hamdan Carpentry,
Haroon Architectural Hardware Co. LLC,
Hassan Abdulla Al Hannadi & Sons,
HIJAN RESTAURANT & CAFE,
Hilite Building Materials Trading LLC,
Hilite Building Materilas Trading LLC,
HIRA Industries LLC,
Holzcraft Machinery Trading LLC,
Home Solution Building Materials Trading LLC,
Homesmiths,
Homewide,
Hussain Aluminium Co.LLC,
Hydra Car Wash,
Hygiene Concepts LLC,
IHG Brands Lighting LLC,
IKEA,
INDER Interior LLC,
Inflex Hydraulic Engines & Machinery Spare Parts,
Integrated Trading Co. LLC,
INTERGLASS CO.LLC,
Interlink Building Materials Trading LLC,
Isam Kabbani Trading LLC,
Ismail Liaqat Cargo Transport by Heavy Truck LLc,
Istanbul Lighting Eqpt. Trading LLC,
Jai Electricals LLC,
Jasi Building Materials Trading LLC,
JIFCO Trading LLC,
JOGA RAM GENERAL TRADING LLC,
Johns Paints Trading LLC,
Jubily Supermarket LLC,
Juliga Trading FZCO,
K Fix International LLC,
Kallegra Industries LLC,
Kanz Al Madina General Trading,
Kasturi General Trading LLC,
Khair Darbar Restaurant,
Khalid Ahmed Mohammed Auto Spare Parts LLC,
Kitchen & Bath Gallery General Trading LLC,
KP MART,
KSK Trading LLC,
Kuber International Trading LLC,
Lamer Villa A14,
Lapizblue General Trading LLC,
Laspinas Building Materials Trading LLC,
LED Corner Trading LLC,
LED Domain Light Fittings Trading LLC,
Leminar Air Conditioning Company LLC,
Lionsrock General Trading LLC,
Liva Insurance B.S.C,
Lucknow Restaurant,
LZ Trading FZCO,
M Three Building Materials Co. LLC,
M.A.H.Y Khoory & Co LLC,
Majid Bukattara Building Materials Trading LLC,
MAK Power Building Material & Equipment Trading LLC,
Marhaba Garage,
Mariam Almatbkh,
MArwan Saeed Autocare,
MAS Paints & Chemicals Industry,
Masafi Building Materials Trading LLC,
Master Cotton & Gloves,
Matharu Carpentry,
Mazhar Al Madina Gen. Trading LLC,
MBM Navi Parking LLC,
MEDICINE,
MEDICINE EXPENCES,
Mega City Building Materials Trading LLC,
Mega Paint Trading LLC,
Mega Star Resturant,
Megsons Enterprises,
Mena Quality Building Materials LLC,
Meppro Building Materials Trading LLC,
Merza Mohammed Bakery,
Metallic Equipment Hollding LLC,
Metro General Trading LLC,
MG1-4010,
MIG Transport Heavy & Light Truck LLC,
Minrwa Aluminium & Glass LLC,
Mobile Recharge,
Mohamed Abdul Hye Air Condition Spare Parts Trading,
Mohamed Abdulrahim Building Materials Trading LLC,
Mohamed Nasir New Auto Spare Parts LLC,
Mohan And Sons Trading LLC,
Mohd. Al Qama Building Materials Trdg. LLC,
Mohd. Al Qama Cermics Trading LLC,
MOHD. ZAINAL FARAIDOONI LLC,
Motor Land Garage,
Muhammad Abul Qasim Goods Wholesalers LLC,
Muhammad Afgan Resturant Co LLC,
Muhammad Riaz Abdul Ghafoor Transport LLC,
Muhammed Zaheer Transport By Heavy And Light Truck,
Munawer Hussain Auto Maint W Shop,
Munshi Transport,
Murshd Auto Spare Part Trdge,
MVP Appliances,
My Homes Building Metal Product Trading LLC,
NAD AL HAMAR PHARMACY LLC,
Najmaal Musallah Pharmacy,
Najmat Al Seeh,
Nasser Al Matrooshi Trading LLC,
National Parking Co Ltd,
Nediyathu Electrical Equipment Reparing LLC,
Nesto Hypermarket,
Network International LLC,
New Martech Airco.&Ref Spare Trading Co Llc,
New Qamar Al Huda Trading LLC,
New Royal Auto Sprae Parts Trading LLC,
New Spicy Palacerestaurant,
NICEWAY TRADING FZCO,
Nine Star Trading Co. LLC,
Noaf Interior LLC,
Noaf Interiors LLC,
Noor Al Maqdis Hardware & Elt Tr LLC,
Noor Al Satwa Cargo Transport By Light Truck LLC,
Noor Al Taj Foodstuff Trading CoLLC,
Norman Maxim Trading LLC,
Obaid Masood Building Materials Trading LLC,
Obaid Masood Building Matericals Trading LLC,
OD International Trading FZCO,
Omar Mohammed Ind. Gas Trading,
Orient Insurance PJSC,
OV LIGHTING FZCO,
Pak Darbar Restaurant,
Pak Malabar Restaurant,
Panache Building Materials Trading LLC,
Parkonic Parking System & Management LLC,
Pathan Darbar Restaurant,
Pearl Pool Trading LLC,
Perfect Design Furniture Upholstery EST,
Pickup For Rent,
Planet Eco Building Materials LLC,
Power Cool Trading LLC,
Prakash Pump EST,
Prakash Trading Co LLC,
Precision Electricals Co LLC,
Premier Auto Parts LLC,
Prime A/C Industries LLC,
Prime Vision Industrial GasTrading LLC,
Pro Shop,
Professional Acrylic Middle East Glass & Plastic En,
Proteam Europa M.E LLC,
Puranmal Restaurant,
Qamar Al Sahra Building Materials Trading LLC,
Qasr Al Khair Kitchen,
Qcon General Trading LLC,
Qubeart General Trading LLC,
Quick Ever Cleaning Services,
Quick Heat Electricals Trading LLC,
Raheel Transport LLC,
RAJ Infotech LLC,
Rajan Sweets & Snacks Restarant,
Rajasthan Restaurant LLC,
Raneen International Trading LLC,
RAPIDCOOL TRADING CO. LLC,
Rashed Al Shamsi Transport LLC,
Rashed Bin Darwish Technical Services LLC,
Rasheed Nooh Cleaning Services,
Red Crown CArgo Transport By Heavy Truck LLC,
Red Stars Car Accessories Trading Co. LLC,
Redpepper Restaurant BR,
Reem Al Sahra Car Park,
Reliance Veneer Timber Trading LLC,
RESCO Cargo Transport by Trucks LLC,
Rhine Building Materials Tr. Co. LLC,
Right Choice Equipment Trading LLC,
Right Source Building Materials Trading LLC,
RISALA CARPENTRY,
Rosso Home Trading FZCO,
Royal Key Lock Repairing LLC,
Royal Vision Glass Industries LLC,
Royat Al Mostaqbal Car Accessories,
RS Building Materials Trading Co. LLC,
RTA,
RTA Metro,
RTA Parking,
RTA Taxis,
Rubaiya Zueaid Bldg Materials Co. LLC,
Rukn Shams Al Khan Const. Equip. Rental,
Rustaq Vehical Towing LLC,
Sabco General Land Transport,
Sabco Motor Vehicle Repairing,
Sabin Plastic Industries LLC,
SAFARIO Trading Co. LLC,
Safe Future Safety Equipment Installation Co LLC,
Saga Veneers Trading LLC,
Saif Al Burhan Traders LLC,
Saifee Aluminium and Steel Trading LLC,
Salik,
Sallan Lighting LLC,
Salsabil Building Materials LLC,
Samco Rental,
Sandeep Banth Transport LLC,
Sarooj Dam,
SAS Express Building Material Trading LLC,
Saseen Foam & Furniture Industry LLC,
Scientechnic LLC,
Seven Colors Building Materials Trading LLC,
Shaan Global Building Material Trading LLC,
Shafiq Wood Products Trading,
Shaklan3 Supermarket,
Shams Alsurur Restaurant & Careteria LLC,
Shams Pakistan Resturant 2024,
Sharptech Equip. Main Workshop,
Shree Kunj Restaurant LLC,
Shuaa Al Madinah Equip & Machines Tr,
Signature Builing Materials Trading LLC,
Simba Wood Industries LLc,
Simba Woods Industries LLC,
Sina Star Tyres,
SKY ACCESS TRANSPORT L.L.C,
Skylight HVAC Trading LLC,
SMART LOOK CAR WASH,
Smooth Solution Building Materials Trading LLC,
SO Pure Water,
Sofa Master Furniture Upholstery LLC,
Space and Style FZE,
Speedex,
Spicy Palace Restaurant and Cafeteria,
Spinneys,
Stallion Metal Works LLC,
Stalwart Solution LLC,
Star Baby Electronics Trading LLC,
Star Line Car Washing & Cleaning,
Strom Power,
Sufouh Gardens Supermarket,
Sultan Industrial Machines Trading LLC,
Summer King Industries LLC.,
Summer Star Auto Electrical Work,
Sunrise Oasis Lighting L.L.C.,
Supercare Pharmacy,
T S M,
Taj Al Murjan Trading LLC,
Taqeef,
Targetlink Building Material Trading LLC,
Tarik Al Najah Car Park Rental & Management,
Tariq Al Rawabit Building Materials Trading LLC,
Tariq Alnajah Car Park Rental & Management,
Tasjeel,
TEKA Kuchentechnik UAE LLC,
TESTHUB LABORATORIES L.L.C,
Texryn Etrade Solution,
The Ceiling Fan Company LLC,
Thriq Alnajah Car Park Rental & Management,
Tierra Marble International LLC,
Tile Line International Services LLC,
Timber Craft Wood Manufacturing LLC,
Tipper Service M Sarwar,
Tokio Marine Nichido,
Topwell International Marble TR LLC,
Transpark,
TRIDENT APPARELS FZE,
TTE Production & Soluthion,
Turab Bhai Trading CO LLC,
UEG Pumps & Engines Trading & Services LLC,
Ugarit City Paints Trading,
Unique General Trading LLC,
UP Star Restaurant LLC,
UPC World Trading LLC,
Variety International Trading LLC,
Victory Team Grocery,
Watch & Talk Wholesale & Retail LLC,
Water Bird Water Treatment Chemicals LLC,
West Zone Fresh,
Women Carpentry Workshop,
Wood Zone Timber Trading LLC,
Woodstock Trading LLC,
WURTH Gulf LLC,
Yaqoot Al Madina Mini Mart LLC,
Yousuf & Joseph Air Conditioning Trading LLC,
Zaiqa Alkebab Resturant,
Zirkoon General Trading,